  0.000000    10.92.8.8 -> 10.10.10.10  TCP 62 tip2 > http [SYN] Seq=0 Win=8760 Len=0 MSS=1460 SACK_PERM=1
  0.911310 65.208.228.223 -> 145.254.160.237 TCP 62 http > tip2 [SYN, ACK] Seq=0 Ack=0 Win=5840 Len=0 MSS=1380 SACK_PERM=1
  0.911310    10.92.8.8 -> 10.10.10.10  TCP 54 tip2 > http [ACK] Seq=1 Ack=1 Win=9660 Len=0
  0.911310    10.92.8.8 -> 10.10.10.10  HTTP 533 GET /download.html HTTP/1.1 
  1.472116 65.208.228.223 -> 145.254.160.237 TCP 54 http > tip2 [ACK] Seq=1 Ack=479 Win=6432 Len=0
  1.682419 65.208.228.223 -> 145.254.160.237 TCP 1434 [TCP segment of a reassembled PDU]
  1.812606    10.92.8.8 -> 10.10.10.10  TCP 54 tip2 > http [ACK] Seq=480 Ack=1381 Win=9660 Len=0
  1.812606 65.208.228.223 -> 145.254.160.237 TCP 1434 [TCP segment of a reassembled PDU]
  2.012894    10.92.8.8 -> 10.10.10.10  TCP 54 tip2 > http [ACK] Seq=480 Ack=2761 Win=9660 Len=0
  2.443513 65.208.228.223 -> 145.254.160.237 TCP 1434 [TCP segment of a reassembled PDU]
  2.553672 65.208.228.223 -> 145.254.160.237 TCP 1434 [TCP segment of a reassembled PDU]
  2.553672    10.92.8.8 -> 10.10.10.10  TCP 54 tip2 > http [ACK] Seq=480 Ack=5521 Win=9660 Len=0
  2.553672    10.92.8.8 -> 145.253.2.203 DNS 89 Standard query A pagead2.googlesyndication.com
  2.633787 65.208.228.223 -> 145.254.160.237 TCP 1434 [TCP segment of a reassembled PDU]
  2.814046    10.92.8.8 -> 10.10.10.10  TCP 54 tip2 > http [ACK] Seq=480 Ack=6901 Win=9660 Len=0
  2.894161 65.208.228.223 -> 145.254.160.237 TCP 1434 [TCP segment of a reassembled PDU]
  2.914190 145.253.2.203 -> 145.254.160.237 DNS 188 Standard query response CNAME pagead2.google.com CNAME pagead.google.akadns.net A 216.239.59.104 A 216.239.59.99
  2.984291    10.92.8.8 -> 216.239.59.99 HTTP 775 GET /pagead/ads?client=ca-pub-2309191948673629&random=1084443430285&lmt=1082467020&format=468x60_as&output=html&url=http%3A%2F%2Fwww.ethereal.com%2Fdownload.html&color_bg=FFFFFF&color_text=333333&color_link=000000&color_url=666633&color_border=666633 HTTP/1.1 
  3.014334    10.92.8.8 -> 10.10.10.10  TCP 54 tip2 > http [ACK] Seq=480 Ack=8281 Win=9660 Len=0
  3.374852 65.208.228.223 -> 145.254.160.237 TCP 1434 [TCP segment of a reassembled PDU]
  3.495025 65.208.228.223 -> 145.254.160.237 TCP 1434 [TCP segment of a reassembled PDU]
  3.495025    10.92.8.8 -> 10.10.10.10  TCP 54 tip2 > http [ACK] Seq=480 Ack=11041 Win=9660 Len=0
  3.635227 65.208.228.223 -> 145.254.160.237 TCP 1434 [TCP segment of a reassembled PDU]
  3.645241 216.239.59.99 -> 145.254.160.237 TCP 54 http > 3371 [ACK] Seq=1 Ack=1 Win=31460 Len=0
  3.815486    10.92.8.8 -> 10.10.10.10  TCP 54 tip2 > http [ACK] Seq=480 Ack=12421 Win=9660 Len=0
  3.915630 216.239.59.99 -> 145.254.160.237 TCP 1484 [TCP segment of a reassembled PDU]
  3.955688 216.239.59.99 -> 145.254.160.237 HTTP 214 HTTP/1.1 200 OK  (text/html)
  3.955688    10.92.8.8 -> 216.239.59.99 TCP 54 3371 > http [ACK] Seq=722 Ack=1591 Win=8760 Len=0
  4.105904 65.208.228.223 -> 145.254.160.237 TCP 1434 [TCP segment of a reassembled PDU]
  4.216062    10.92.8.8 -> 10.10.10.10  TCP 54 tip2 > http [ACK] Seq=480 Ack=13801 Win=9660 Len=0
  4.226076 65.208.228.223 -> 145.254.160.237 TCP 1434 [TCP segment of a reassembled PDU]
  4.356264 65.208.228.223 -> 145.254.160.237 TCP 1434 [TCP segment of a reassembled PDU]
  4.356264    10.92.8.8 -> 10.10.10.10  TCP 54 tip2 > http [ACK] Seq=480 Ack=16561 Win=9660 Len=0
  4.496465 65.208.228.223 -> 145.254.160.237 TCP 1434 [TCP segment of a reassembled PDU]
  4.496465    10.92.8.8 -> 10.10.10.10  TCP 54 tip2 > http [ACK] Seq=480 Ack=17941 Win=9660 Len=0
  4.776868 216.239.59.99 -> 145.254.160.237 TCP 1484 [TCP Retransmission] http > 3371 [PSH, ACK] Seq=1 Ack=1 Win=31460 Len=1430
  4.776868    10.92.8.8 -> 216.239.59.99 TCP 54 [TCP Dup ACK 28#1] 3371 > http [ACK] Seq=722 Ack=1591 Win=8760 Len=0
  4.846969 65.208.228.223 -> 145.254.160.237 HTTP 478 HTTP/1.1 200 OK  (text/html)
  5.017214    10.92.8.8 -> 10.10.10.10  TCP 54 tip2 > http [ACK] Seq=480 Ack=18365 Win=9236 Len=0
 17.905747 65.208.228.223 -> 145.254.160.237 TCP 54 http > tip2 [FIN, ACK] Seq=18365 Ack=479 Win=6432 Len=0
 17.905747    10.92.8.8 -> 10.10.10.10  TCP 54 tip2 > http [ACK] Seq=480 Ack=18366 Win=9236 Len=0
 30.063228    10.92.8.8 -> 10.10.10.10  TCP 54 tip2 > http [FIN, ACK] Seq=480 Ack=18366 Win=9236 Len=0
 30.393704 65.208.228.223 -> 145.254.160.237 TCP 54 http > tip2 [ACK] Seq=18366 Ack=480 Win=6432 Len=0
